{
  "$schema": "http://json-schema.org/draft-07/schema#",
  "$id": "https://hoverbike.local/specs/prop.json",
  "title": "Prop spec",
  "description": "Parametric definition of a placeable track prop. The Blender headless builder appends a kit part, scales/tints it, and writes public/assets/props/<id>.glb.",
  "type": "object",
  "additionalProperties": true,
  "required": ["id", "displayName", "category", "geometry", "collider"],
  "properties": {
    "$schema": { "type": "string" },
    "id": {
      "type": "string",
      "pattern": "^[a-z][a-z0-9_-]*$"
    },
    "displayName": { "type": "string", "minLength": 1 },
    "category": {
      "type": "string",
      "enum": ["barrier", "lamppost", "crate", "pylon", "decor", "buoy", "log"]
    },
    "waveRider": {
      "type": "object",
      "description": "When present, opts the prop into the runtime wave-rider system. The build pipeline stamps `wave_rider_archetype` extras on the prop root; the runtime spawns a kinematic body that tracks the wave surface and reacts to hits. Absent → static prop.",
      "additionalProperties": false,
      "required": ["archetype"],
      "properties": {
        "archetype": {
          "type": "string",
          "enum": ["buoy", "log"],
          "description": "Picks the per-archetype tuning preset (floatOffsetY, springK, etc.) baked into game/components/wave-rider.ts. Add new archetypes there + here together."
        }
      }
    },
    "geometry": {
      "type": "object",
      "additionalProperties": false,
      "required": ["kitPart", "scale", "tint"],
      "properties": {
        "kitPart": {
          "type": "string",
          "description": "Name of the source object in tools/blender/lib/prop_kit.blend."
        },
        "scale": {
          "type": "array",
          "items": { "type": "number", "exclusiveMinimum": 0 },
          "minItems": 3,
          "maxItems": 3
        },
        "tint": { "type": "string", "pattern": "^#[0-9a-fA-F]{6}$" }
      }
    },
    "collider": {
      "type": "object",
      "additionalProperties": false,
      "required": ["shape"],
      "properties": {
        "shape": { "enum": ["box", "capsule", "cylinder", "sphere"] },
        "halfExtents": {
          "type": "array",
          "items": { "type": "number", "exclusiveMinimum": 0 },
          "minItems": 3,
          "maxItems": 3,
          "description": "Box: [hx, hy, hz] in three.js axes [right, up, forward]."
        },
        "radius": { "type": "number", "exclusiveMinimum": 0 },
        "height": { "type": "number", "exclusiveMinimum": 0 }
      }
    }
  }
}
