{
  "$schema": "../_schema/prop.json",
  "id": "log",
  "displayName": "Drift Log",
  "category": "log",
  "geometry": {
    "kitPart": "crate",
    "scale": [2.4, 0.6, 0.6],
    "tint": "#6b4a2a"
  },
  "collider": {
    "shape": "cylinder",
    "radius": 0.3,
    "height": 2.4
  },
  "waveRider": {
    "archetype": "log"
  }
}
