{
  "$schema": "../_schema/prop.json",
  "id": "buoy",
  "displayName": "Marker Buoy",
  "category": "buoy",
  "geometry": {
    "kitPart": "buoy",
    "scale": [1.0, 1.0, 1.0],
    "tint": "#d83d2a"
  },
  "collider": {
    "shape": "cylinder",
    "radius": 0.4,
    "height": 0.9
  },
  "waveRider": {
    "archetype": "buoy"
  }
}
